{
  "$schema": "http://json-schema.org/draft-07/schema#",
  "title": "Weekly Language Lesson Plan",
  "description": "The complete structure for a 7-day language lesson plan, designed to be in a single file per week (e.g., week_1.json).",
  "type": "object",
  "properties": {
    "week": {
      "description": "The week number this lesson plan is for.",
      "type": "number"
    },
    "path": {
      "description": "The learning path this lesson belongs to.",
      "type": "string",
      "enum": ["survival", "alphabet", "numbers"]
    },
    "targetLanguage": {
      "description": "The language being taught (e.g., 'French').",
      "type": "string"
    },
    "nativeLanguage": {
      "description": "The user's native language for translations (e.g., 'English', 'Sinhala').",
      "type": "string"
    },
    "days": {
      "type": "array",
      "description": "An array containing exactly 7 daily lesson objects.",
      "minItems": 7,
      "maxItems": 7,
      "items": {
        "description": "The full object for a single day's lesson. This should conform to the daily lesson schema.",
        "type": "object",
        "properties": {
          "week": { "type": "number" },
          "day": { "type": "number", "minimum": 1, "maximum": 7 },
          "letter": { "type": "string" },
          "title": { "type": "string" },
          "title_native": { "type": "string" },
          "theme": { "type": "string" },
          "path": { "type": "string", "enum": ["survival", "alphabet", "numbers"] },
          "targetLanguage": { "type": "string" },
          "nativeLanguage": { "type": "string" },
          "words": { "type": "array", "minItems": 6, "maxItems": 6 },
          "sentences": { "type": "array", "minItems": 4, "maxItems": 4 },
          "dialogues": { "type": "array", "minItems": 4, "maxItems": 4 },
          "exercises": {
            "type": "object",
            "properties": {
              "sentenceScramble": {
                "type": "array",
                "minItems": 1
              },
               "fillBlanks": {
                "type": "array",
                "minItems": 1
              },
              "matching": {
                "type": "array",
                "minItems": 1
              }
            },
            "required": ["sentenceScramble", "fillBlanks", "matching"]
          },
          "cultural_note": { "type": "string" },
          "pronunciation_tip": { "type": "string" },
          "progress": { "type": "object" }
        },
        "required": ["week", "day", "title", "title_native", "theme", "path", "targetLanguage", "nativeLanguage", "words", "sentences", "dialogues", "exercises", "cultural_note", "pronunciation_tip", "progress"]
      }
    }
  },
  "required": ["week", "path", "targetLanguage", "nativeLanguage", "days"]
}
