{
  "week": 4,
  "path": "survival",
  "targetLanguage": "Chinese",
  "nativeLanguage": "Sinhala",
  "days": [
    {
      "week": 4,
      "day": 1,
      "title": "4 වන සතිය, 1 වන දිනය: ආපනශාලාවකදී",
      "title_native": "第四周，第一天：在餐厅",
      "theme": "Ordering at a Restaurant",
      "path": "survival",
      "targetLanguage": "Chinese",
      "nativeLanguage": "Sinhala",
      "words": [
        {
          "id": "w4_1_1",
          "target": "菜单",
          "phonetic": "සයි-ඩාන්",
          "native_meaning": "මෙනුව",
          "english": "Menu",
          "example_sentence_target": "请给我菜单。",
          "example_sentence_native": "කරුණාකර මට මෙනුව දෙන්න.",
          "example_sentence_phonetic": "චිං ගෙයි වෝ සයි-ඩාන්."
        },
        {
          "id": "w4_1_2",
          "target": "点菜",
          "phonetic": "ඩියෙන්-සයි",
          "native_meaning": "කෑම ඇණවුම් කරනවා",
          "english": "To order food",
          "example_sentence_target": "你好，我要点菜。",
          "example_sentence_native": "ආයුබෝවන්, මට කෑම ඇණවුම් කරන්න අවශ්‍යයි.",
          "example_sentence_phonetic": "නී හાઓ, වෝ යාඕ ඩියෙන්-සයි."
        },
        {
          "id": "w4_1_3",
          "target": "这个",
          "phonetic": "ජ-ග",
          "native_meaning": "මේක",
          "english": "This one",
          "example_sentence_target": "我要这个。",
          "example_sentence_native": "මට මේක ඕන.",
          "example_sentence_phonetic": "වෝ යාඕ ජ-ග."
        },
        {
          "id": "w4_1_4",
          "target": "米饭",
          "phonetic": "මී-ෆාන්",
          "native_meaning": "බත්",
          "english": "Cooked rice",
          "example_sentence_target": "请给我一碗米饭。",
          "example_sentence_native": "කරුණාකර මට බත් කෝප්පයක් දෙන්න.",
          "example_sentence_phonetic": "චිං ගෙයි වෝ යී වන් මී-ෆාන්."
        },
        {
          "id": "w4_1_5",
          "target": "买单",
          "phonetic": "මායි-ඩාන්",
          "native_meaning": "බිල ගෙවනවා",
          "english": "To pay the bill",
          "example_sentence_target": "服务员，买单。",
          "example_sentence_native": "වේටර්, බිල දෙන්න.",
          "example_sentence_phonetic": "ෆු-වූ-යුවාන්, මායි-ඩාන්."
        }
      ],
      "sentences": [
        {
          "id": "s4_1_1",
          "target": "这里有人吗？",
          "native": "මෙතන කවුරුහරි ඉන්නවද?",
          "phonetic": "ජ-ලී යෝ රෙන් මා?"
        },
        {
          "id": "s4_1_2",
          "target": "你们有什么推荐的？",
          "native": "ඔබ නිර්දේශ කරන්නේ මොනවද?",
          "phonetic": "නී-මන් යෝ ෂෙන්-ම ටුයි-ජියෙන් ද?"
        },
        {
          "id": "s4_1_3",
          "target": "我不要辣的。",
          "native": "මට සැර එපා.",
          "phonetic": "වෝ බූ යාඕ ලා ද."
        },
        {
          "id": "s4_1_4",
          "target": "请给我一杯水。",
          "native": "කරුණාකර මට වතුර වීදුරුවක් දෙන්න.",
          "phonetic": "චිං ගෙයි වෝ යී බේයි ෂුයි."
        }
      ],
      "dialogues": [
        {
          "id": "d4_1_1",
          "context": "ආපනශාලාවකට ඇතුළු වීම.",
          "lines": [
            {
              "speaker": "A",
              "target": "你好，两位。",
              "native": "ආයුබෝවන්, දෙන්නෙක්.",
              "phonetic": "නී හાઓ, ලියං වෙයි."
            },
            {
              "speaker": "B",
              "target": "好的，请这边坐。",
              "native": "හොඳයි, කරුණාකර මෙතනින් වාඩිවෙන්න.",
              "phonetic": "හાઓ ද, චිං ජ-බියෙන් සුවෝ."
            }
          ]
        },
        {
          "id": "d4_1_2",
          "context": "මෙනුව ඉල්ලීම.",
          "lines": [
            {
              "speaker": "A",
              "target": "你好，请给我菜单。",
              "native": "ආයුබෝවන්, කරුණාකර මට මෙනුව දෙන්න.",
              "phonetic": "නී හાઓ, චිං ගෙයි වෝ සයි-ඩාන්."
            },
            {
              "speaker": "B",
              "target": "好的，给你。",
              "native": "හොඳයි, මෙන්න ගන්න.",
              "phonetic": "හાઓ ද, ගෙයි නී."
            }
          ]
        },
        {
          "id": "d4_1_3",
          "context": "කෑමක් ගැන ඇසීම.",
          "lines": [
            {
              "speaker": "A",
              "target": "这个是什么菜？",
              "native": "මේ මොන කෑමක්ද?",
              "phonetic": "ජ-ග ෂී ෂෙන්-ම සයි?"
            },
            {
              "speaker": "B",
              "target": "这是北京烤鸭。",
              "native": "මේ බීජිං තාරා.",
              "phonetic": "ජ-ෂී බේ-ජිං කාඕ-යා."
            }
          ]
        },
        {
          "id": "d4_1_4",
          "context": "බිල ඉල්ලීම.",
          "lines": [
            {
              "speaker": "A",
              "target": "服务员，买单。",
              "native": "වේටර්, බිල දෙන්න.",
              "phonetic": "ෆු-වූ-යුවාන්, මායි-ඩාන්."
            },
            {
              "speaker": "B",
              "target": "好的，一共一百元。",
              "native": "හොඳයි, මුළු යුවාන් සියයයි.",
              "phonetic": "හાઓ ද, යී-ගොං යී-බායි යුවාන්."
            }
          ]
        }
      ],
      "exercises": {
        "fillBlanks": [
          {
            "id": "fb4_1_1",
            "sentence": "请给我 ___。",
            "answer": "菜单",
            "hint": "මෙනුව"
          }
        ],
        "matching": [
          {
            "id": "m4_1_1",
            "target": "我要这个。",
            "native": "මට මේක ඕන."
          },
          {
            "id": "m4_1_2",
            "target": "买单",
            "native": "බිල ගෙවනවා"
          }
        ],
        "sentenceScramble": [
          {
            "id": "ss4_1_1",
            "scrambled": ["我", "米饭", "要"],
            "correct": "我要米饭。",
            "nativeHint": "මට බත් ඕන."
          }
        ]
      },
      "cultural_note": "චීනයේදී, විශේෂයෙන් කණ්ඩායමක් සමඟ ආහාර ගන්නා විට, ආහාර බෙදා ගැනීම ඉතා සාමාන්‍ය දෙයකි. මේසයේ සිටින සැමට බෙදා ගැනීමට විවිධ කෑම වර්ග කිහිපයක් ඇණවුම් කිරීම සිරිතකි.",
      "pronunciation_tip": "චීන භාෂාවේ ස්වර (tones) ඉතා වැදගත්. 'mǎidān' (买单 - බිල ගෙවීම) සහ 'màidān' (卖单 - බිල විකිණීම) අතර වෙනස තේරුම් ගන්න. තුන්වන ස්වරය (පහළට ගොස් ඉහළට) සහ හතරවන ස්වරය (තදින් පහළට) පුහුණු වන්න.",
      "progress": {
        "xp": 100,
        "streak_bonus": 20,
        "badge": "W4D1-Restaurant"
      }
    },
    {
      "week": 4,
      "day": 2,
      "title": "4 වන සතිය, 2 වන දිනය: වෙළඳපොලේ",
      "title_native": "第四周，第二天：在市场",
      "theme": "At the Market",
      "path": "survival",
      "targetLanguage": "Chinese",
      "nativeLanguage": "Sinhala",
      "words": [
        {
          "id": "w4_2_1",
          "target": "多少钱",
          "phonetic": "ඩුවෝ-ෂාඕ චියෙන්",
          "native_meaning": "කීයද?",
          "english": "How much money?",
          "example_sentence_target": "这个多少钱？",
          "example_sentence_native": "මේක කීයද?",
          "example_sentence_phonetic": "ජ-ග ඩුවෝ-ෂාඕ චියෙන්?"
        },
        {
          "id": "w4_2_2",
          "target": "太贵了",
          "phonetic": "ටායි ගුයි ල",
          "native_meaning": "ගණන් වැඩියි",
          "english": "Too expensive",
          "example_sentence_target": "太贵了，便宜一点吧。",
          "example_sentence_native": "ගණන් වැඩියි, ටිකක් අඩු කරන්න.",
          "example_sentence_phonetic": "ටායි ගුයි ල, පියෙන්-යී යී-ඩියෙන් බා."
        },
        {
          "id": "w4_2_3",
          "target": "斤",
          "phonetic": "ජින්",
          "native_meaning": "ජින් (ග්‍රෑම් 500)",
          "english": "Jin (500 grams)",
          "example_sentence_target": "我要一斤苹果。",
          "example_sentence_native": "මට ඇපල් ජින් එකක් ඕන.",
          "example_sentence_phonetic": "වෝ යාඕ යී ජින් පිං-ගුවෝ."
        },
        {
          "id": "w4_2_4",
          "target": "水果",
          "phonetic": "ෂුයි-ගුවෝ",
          "native_meaning": "පළතුරු",
          "english": "Fruit",
          "example_sentence_target": "你喜欢吃什么水果？",
          "example_sentence_native": "ඔයා මොන පළතුරු කන්නද කැමති?",
          "example_sentence_phonetic": "නී ශී-හුවන් ච(ර්) ෂෙන්-ම ෂුයි-ගුවෝ?"
        },
        {
          "id": "w4_2_5",
          "target": "蔬菜",
          "phonetic": "ෂූ-සයි",
          "native_meaning": "එළවළු",
          "english": "Vegetables",
          "example_sentence_target": "这些蔬菜很新鲜。",
          "example_sentence_native": "මේ එළවළු හරිම නැවුම්.",
          "example_sentence_phonetic": "ජ-ෂියේ ෂූ-සයි හෙන් ෂින්-ෂියෙන්."
        }
      ],
      "sentences": [
        {
          "id": "s4_2_1",
          "target": "可以便宜一点吗？",
          "native": "ටිකක් අඩු කරන්න පුළුවන්ද?",
          "phonetic": "ක-යී පියෙන්-යී යී-ඩියෙන් මා?"
        },
        {
          "id": "s4_2_2",
          "target": "我要买两斤西红柿。",
          "native": "මට තක්කාලි ජින් දෙකක් ගන්න ඕන.",
          "phonetic": "වෝ යාඕ මායි ලියං ජින් ෂී-හොං-ෂ(ර්)."
        },
        {
          "id": "s4_2_3",
          "target": "这个怎么卖？",
          "native": "මේක විකුණන්නේ කොහොමද?",
          "phonetic": "ජ-ග සෙන්-ම මායි?"
        },
        {
          "id": "s4_2_4",
          "target": "这些都很新鲜。",
          "native": "මේවා ඔක්කොම හරිම නැවුම්.",
          "phonetic": "ජ-ෂියේ ඩෝ හෙන් ෂින්-ෂියෙන්."
        }
      ],
      "dialogues": [
        {
          "id": "d4_2_1",
          "context": "මිල ඇසීම.",
          "lines": [
            {
              "speaker": "A",
              "target": "老板，苹果多少钱一斤？",
              "native": "ලොක්කා, ඇපල් ජින් එකක් කීයද?",
              "phonetic": "ලාඕ-බාන්, පිං-ගුවෝ ඩුවෝ-ෂාඕ චියෙන් යී ජින්?"
            },
            {
              "speaker": "B",
              "target": "五块钱一斤。",
              "native": "ජින් එකක් යුවාන් පහයි.",
              "phonetic": "වූ කුවායි චියෙන් යී ජින්."
            }
          ]
        },
        {
          "id": "d4_2_2",
          "context": "මිල අඩු කිරීමට ඉල්ලීම.",
          "lines": [
            {
              "speaker": "A",
              "target": "太贵了，便宜一点吧。",
              "native": "ගණන් වැඩියි, ටිකක් අඩු කරන්න.",
              "phonetic": "ටායි ගුයි ල, පියෙන්-යී යී-ඩියෙන් බා."
            },
            {
              "speaker": "B",
              "target": "好吧，四块五。",